{
  "$schema": "urn:open-android-intelligence:protocol:v1:replay-policies-registry",
  "registry_id": "urn:open-android-intelligence:protocol:v1:registry:replay-policies",
  "protocol_version": "1.0",
  "policy_classes": [
    {
      "class_id": "task5_default",
      "retention_rule_id": "retain_until_max_expires_at_or_admitted_at_plus_86400_seconds_v1",
      "max_rows_per_space": "4096",
      "max_retained_bytes_per_space": "67108864",
      "receipt_reservation_bytes": "16384",
      "intent_metadata_ceiling_bytes": null,
      "tombstone_metadata_ceiling_bytes": null,
      "message_types": [
        "adapter_key_rotation",
        "adapter_key_rotation_ack",
        "bridge_key_rotation",
        "bridge_key_rotation_ack",
        "bridge_ping",
        "capability_manifest",
        "data_query_grant_ack",
        "data_query_grant_update",
        "device_key_rotation",
        "device_key_rotation_ack",
        "device_ping",
        "device_presence",
        "device_event",
        "event_ack",
        "authorization_revision_ack",
        "authorization_revision_update",
        "device_protocol_error",
        "bridge_protocol_error",
        "adapter_protocol_error"
      ]
    },
    {
      "class_id": "operation_security_ledger",
      "retention_rule_id": "retain_until_max_operation_expires_at_or_bridge_ack_at_plus_2592000_seconds_v1",
      "max_rows_per_space": "16384",
      "max_retained_bytes_per_space": "9663676416",
      "receipt_reservation_bytes": "262144",
      "intent_metadata_ceiling_bytes": "65536",
      "tombstone_metadata_ceiling_bytes": "2048",
      "message_types": [
        "operation_cancel",
        "operation_command",
        "operation_get",
        "operation_receipt",
        "operation_receipt_ack",
        "operation_reconcile",
        "operation_snapshot",
        "operation_submit",
        "operation_wait",
        "receipt_replay"
      ]
    }
  ],
  "message_classification": [
    { "message_type": "adapter_key_rotation", "class_id": "task5_default", "retention_rule_id": "retain_until_max_expires_at_or_admitted_at_plus_86400_seconds_v1" },
    { "message_type": "adapter_key_rotation_ack", "class_id": "task5_default", "retention_rule_id": "retain_until_max_expires_at_or_admitted_at_plus_86400_seconds_v1" },
    { "message_type": "adapter_protocol_error", "class_id": "task5_default", "retention_rule_id": "retain_until_max_expires_at_or_admitted_at_plus_86400_seconds_v1" },
    { "message_type": "authorization_revision_ack", "class_id": "task5_default", "retention_rule_id": "retain_until_max_expires_at_or_admitted_at_plus_86400_seconds_v1" },
    { "message_type": "authorization_revision_update", "class_id": "task5_default", "retention_rule_id": "retain_until_max_expires_at_or_admitted_at_plus_86400_seconds_v1" },
    { "message_type": "bridge_key_rotation", "class_id": "task5_default", "retention_rule_id": "retain_until_max_expires_at_or_admitted_at_plus_86400_seconds_v1" },
    { "message_type": "bridge_key_rotation_ack", "class_id": "task5_default", "retention_rule_id": "retain_until_max_expires_at_or_admitted_at_plus_86400_seconds_v1" },
    { "message_type": "bridge_ping", "class_id": "task5_default", "retention_rule_id": "retain_until_max_expires_at_or_admitted_at_plus_86400_seconds_v1" },
    { "message_type": "bridge_protocol_error", "class_id": "task5_default", "retention_rule_id": "retain_until_max_expires_at_or_admitted_at_plus_86400_seconds_v1" },
    { "message_type": "capability_manifest", "class_id": "task5_default", "retention_rule_id": "retain_until_max_expires_at_or_admitted_at_plus_86400_seconds_v1" },
    { "message_type": "data_query_grant_ack", "class_id": "task5_default", "retention_rule_id": "retain_until_max_expires_at_or_admitted_at_plus_86400_seconds_v1" },
    { "message_type": "data_query_grant_update", "class_id": "task5_default", "retention_rule_id": "retain_until_max_expires_at_or_admitted_at_plus_86400_seconds_v1" },
    { "message_type": "device_key_rotation", "class_id": "task5_default", "retention_rule_id": "retain_until_max_expires_at_or_admitted_at_plus_86400_seconds_v1" },
    { "message_type": "device_key_rotation_ack", "class_id": "task5_default", "retention_rule_id": "retain_until_max_expires_at_or_admitted_at_plus_86400_seconds_v1" },
    { "message_type": "device_ping", "class_id": "task5_default", "retention_rule_id": "retain_until_max_expires_at_or_admitted_at_plus_86400_seconds_v1" },
    { "message_type": "device_event", "class_id": "task5_default", "retention_rule_id": "retain_until_max_expires_at_or_admitted_at_plus_86400_seconds_v1" },
    { "message_type": "event_ack", "class_id": "task5_default", "retention_rule_id": "retain_until_max_expires_at_or_admitted_at_plus_86400_seconds_v1" },
    { "message_type": "device_presence", "class_id": "task5_default", "retention_rule_id": "retain_until_max_expires_at_or_admitted_at_plus_86400_seconds_v1" },
    { "message_type": "device_protocol_error", "class_id": "task5_default", "retention_rule_id": "retain_until_max_expires_at_or_admitted_at_plus_86400_seconds_v1" },
    { "message_type": "operation_cancel", "class_id": "operation_security_ledger", "retention_rule_id": "retain_until_max_operation_expires_at_or_bridge_ack_at_plus_2592000_seconds_v1" },
    { "message_type": "operation_command", "class_id": "operation_security_ledger", "retention_rule_id": "retain_until_max_operation_expires_at_or_bridge_ack_at_plus_2592000_seconds_v1" },
    { "message_type": "operation_get", "class_id": "operation_security_ledger", "retention_rule_id": "retain_until_max_operation_expires_at_or_bridge_ack_at_plus_2592000_seconds_v1" },
    { "message_type": "operation_receipt", "class_id": "operation_security_ledger", "retention_rule_id": "retain_until_max_operation_expires_at_or_bridge_ack_at_plus_2592000_seconds_v1" },
    { "message_type": "operation_receipt_ack", "class_id": "operation_security_ledger", "retention_rule_id": "retain_until_max_operation_expires_at_or_bridge_ack_at_plus_2592000_seconds_v1" },
    { "message_type": "operation_reconcile", "class_id": "operation_security_ledger", "retention_rule_id": "retain_until_max_operation_expires_at_or_bridge_ack_at_plus_2592000_seconds_v1" },
    { "message_type": "operation_snapshot", "class_id": "operation_security_ledger", "retention_rule_id": "retain_until_max_operation_expires_at_or_bridge_ack_at_plus_2592000_seconds_v1" },
    { "message_type": "operation_submit", "class_id": "operation_security_ledger", "retention_rule_id": "retain_until_max_operation_expires_at_or_bridge_ack_at_plus_2592000_seconds_v1" },
    { "message_type": "operation_wait", "class_id": "operation_security_ledger", "retention_rule_id": "retain_until_max_operation_expires_at_or_bridge_ack_at_plus_2592000_seconds_v1" },
    { "message_type": "receipt_replay", "class_id": "operation_security_ledger", "retention_rule_id": "retain_until_max_operation_expires_at_or_bridge_ack_at_plus_2592000_seconds_v1" }
  ]
}
